{
  "blocker": null,
  "commands_run": [
    {
      "cmd": "V2-001H base gate and mission envelope validation",
      "exit_code": 0
    },
    {
      "cmd": "quarry inventory and evidence review",
      "exit_code": 0
    },
    {
      "cmd": "all legacy Block Node suites",
      "exit_code": 0
    },
    {
      "cmd": "affiliate second-consumer full npm test with Chromium",
      "exit_code": 0
    },
    {
      "cmd": "freeze 18-file affiliate-offer specimen digest",
      "exit_code": 0
    }
  ],
  "created_at": "2026-08-26T16:30:23Z",
  "delegate": "GPT_CONTROL_READ_ONLY_QUARRY_WITH_OPTIONAL_EXPLICIT_LOCAL_BUILDER_PROBES",
  "envelope_ref": "missions/V2-001H.json",
  "evidence": [
    "docs/V2-001H/BLOCK2_SELECTION.md",
    "docs/V2-001H/EVIDENCE.json",
    "Foundation Law section 17: Block #2 is the composition test",
    "selection authorises no ingest/admission/implementation"
  ],
  "files_changed": [
    {
      "change": "modified",
      "path": "GPT_LOG.jsonl",
      "sha256": "a15c9284920f6862a426f5b75ee53fd4b7fa9f90d71c5e46ddc8d54348c360f2"
    },
    {
      "change": "modified",
      "path": "GPT_STATE.json",
      "sha256": "803d3181ef710d819684fd3caabe78e3bf0f637e8469d9233607cf0beaabb57a"
    },
    {
      "change": "modified",
      "path": "V2_CHRONICLE.md",
      "sha256": "5567928f3354ffd37f5f5b4f047042a554e6b311833434f4d13e0a63a9e87bc3"
    },
    {
      "change": "added",
      "path": "missions/V2-001H.json",
      "sha256": "1250bf8122ecf86884658533bd5eca22e6032775ca1bff5cf381a7210972d5e6"
    },
    {
      "change": "added",
      "path": "docs/V2-001H/BLOCK2_SELECTION.md",
      "sha256": "f6bf1bd78d7693a5a884126ba187987ab6d919b6975c05820ee8d57c8ad6970b"
    },
    {
      "change": "added",
      "path": "docs/V2-001H/EVIDENCE.json",
      "sha256": "f2689b79096e1d78f5d48cdb9995513dde3c8b031256aa25cf17717dc1184d20"
    }
  ],
  "mission_id": "V2-001H",
  "next_state": "WAIT_GPT",
  "objective": "Quarry, compare and select the best candidate for Capability Block #2 from the real legacy estate, proving the choice can compose beside Block #1 without redesigning the V2 foundation.",
  "receipt_id": "V2-001H--20260826T163023Z",
  "remote_sha": null,
  "repo_sha": null,
  "result_claimed": "COMPLETE",
  "schema_version": "1.0.0",
  "sync_status": "NOT_SYNCED",
  "tests": [
    {
      "detail": "9 non-Block-1 candidates inventoried from committed othrys-blocks stock",
      "name": "candidate inventory",
      "result": "pass"
    },
    {
      "detail": "provider-router 4/4; event-log 2/2; visit-tracking 18/18; supabase-session 3/3; grounded-retrieval 2/2; source-extraction 3/3; gap-engine 2/2; mastery-ledger 2/2; affiliate-offer 27/27",
      "name": "all quarry Node suites",
      "result": "pass"
    },
    {
      "detail": "same-source + copy-hunt + 8/8 Node + 10/10 Chromium; repo clean at 79062a11dcc9333382746cc1c912cba56ef3492a",
      "name": "affiliate second consumer",
      "result": "pass"
    },
    {
      "detail": "candidate verification introduced no quarry mutations; pre-existing image-prep working specimen unchanged",
      "name": "quarry integrity",
      "result": "pass"
    }
  ]
}
